<!ELEMENT slines (sline+)> 

<!ELEMENT sline (entry+)> 
<!ATTLIST sline     
	name CDATA #REQUIRED  
    >    
<!ELEMENT entry EMPTY> 
<!ATTLIST entry     
	station CDATA #REQUIRED 
	arrival CDATA #REQUIRED    
    	departure CDATA #REQUIRED
	>  

