<?xml version="1.0" encoding='UTF-8'?>
<!DOCTYPE slines SYSTEM "schedule.dtd">

<slines>

<sline name="Linie4">
<entry station="Werdhoelzli" arrival="0" departure="0"/>
<entry station="Baendliweg" arrival="2" departure="3"/>
<entry station="Gruenaustrasse" arrival="4" departure="5"/>
</sline>

<sline name="Linie13">
<entry station="Frankental" arrival="0" departure="0"/>
<entry station="Wartau" arrival="2" departure="3"/>
<entry station="Zwielplatz" arrival="4" departure="5"/>
</sline>

</slines>
 